{
  "schema_version": "doctrine-scenario/2",
  "id": "authority-present",
  "description": "Explicit authority permits a bounded regeneration decision.",
  "authority": {
    "decision_owner": "repository owner",
    "authorization_granted": true,
    "scope": ["regenerate outputs whose source changed and whose integrity check finds no manual edits"]
  },
  "evidence": [
    {
      "schema_version": "evidence-record/1",
      "id": "source-hash-change",
      "evidence_class": "evidence-generated-artifacts",
      "summary": "The recorded source hash differs from the current source hash.",
      "provenance": [{"locator": "synthetic/source.json#sha256", "method": "hash comparison"}]
    },
    {
      "schema_version": "evidence-record/1",
      "id": "integrity-check-clean",
      "evidence_class": "evidence-generated-artifacts",
      "summary": "The integrity check found no unexpected manual edits.",
      "provenance": [{"locator": "synthetic/integrity-check.json#manual_edits", "method": "manifest comparison"}]
    }
  ],
  "expected": {
    "required_assertion_types": [
      "observation",
      "inference",
      "recommendation",
      "decision",
      "authorization"
    ],
    "forbidden_assertion_types": ["execution", "verification", "acceptance"],
    "required_retrieval_ids": ["source-hash-change", "integrity-check-clean"],
    "forbidden_retrieval_ids": ["unrelated-book-status"]
  }
}
